,number,title,authors,info,url
89,8590,"РЕАЛИЗАЦИЯ КОНЦЕПЦИИ ИНДУСТРИЯ 4.0 ДЛЯ УСТОЙЧИВОГО РАЗВИТИЯ ТЕЛЕКОММУНИКАЦИОННОГО ПРЕДПРИЯТИЯФортунова У.В., Бабкин А.В.



 В сборнике: Промышленная политика в цифровой экономике: проблемы и перспективы. Труды научно-практической конференции с международным участием. Под ред. А.В. Бабкина. 2017.  С. 157-162.","Фортунова У.В., Бабкин А.В.",,https://www.elibrary.ru/item.asp?id=32394819
90,8591,"PROBLEMS OF TRAINING OF HIGHLY QUALIFIED SPECIALISTSKozlova L.P., Kozlova O.A.



 В сборнике: 2017 IEEE VI Forum Strategic Partnership of Universities and Enterprises of Hi-Tech Branches (Science. Education. Innovations) (SPUE). 2017.  С. 159-161.","Kozlova L.P., Kozlova O.A.",,https://www.elibrary.ru/item.asp?id=35734570
91,8592,"АРХИТЕКТУРА ЦИФРОВЫХ ОБЪЕКТОВ КАК ОСНОВА ИДЕНТИФИКАЦИИ УСТРОЙСТВ ИНТЕРНЕТА ВЕЩЕЙ В СЕТЯХ 5G/IMT-2020Аль-Бахри М.С., Киричек Р.В.



 В сборнике: Интернет вещей и 5G (INTHITEN 2017). 3-я международная научно-техническая конференция студентов, аспирантов и молодых ученых. Под редакцией А. Е. Кучерявого. 2017.  С. 159-163.","Аль-Бахри М.С., Киричек Р.В.",,https://www.elibrary.ru/item.asp?id=32647566
92,8593,"INVESTIGATION OF METHODS FOR REMOTE CONTROL IOT-DEVICES BASED ON CLOUD PLATFORMS AND DIFFERENT INTERACTION PROTOCOLSKhakimov A., Muthanna A., Kirichek R., Koucheryavy A., Muthanna M.S.A.



 В сборнике: Proceedings of the 2017 IEEE Conference of Russian Young Researchers in Electrical and Electronic Engineering (EIConRus). 2017.  С. 160-163.","Khakimov A., Muthanna A., Kirichek R., Koucheryavy A., Muthanna M.S.A.",,https://www.elibrary.ru/item.asp?id=29080357
93,8594,"ОБЗОР КОНЦЕПЦИИ ТАКТИЛЬНОГО ИНТЕРНЕТА. ПРИМЕНЕНИЕ. ПРОБЛЕМЫ, СВЯЗАННЫЕ С ВНЕДРЕНИЕМСеребрякова А.А., Киричек Р.В.



 В сборнике: Интернет вещей и 5G (INTHITEN 2017). 3-я международная научно-техническая конференция студентов, аспирантов и молодых ученых. Под редакцией А. Е. Кучерявого. 2017.  С. 164-170.","Серебрякова А.А., Киричек Р.В.",,https://www.elibrary.ru/item.asp?id=32647567
94,8595,"СЕТИ БЕСПИЛОТНЫХ ЛЕТАТЕЛЬНЫХ АППАРАТОВ КАК ЭЛЕМЕНТ ИНФРАСТРУКТУРЫ УМНЫХ ГОРОДОВКиричек Р.В.



 В сборнике: 72-я Всероссийская научно-техническая конференция, посвященная Дню радио. Труды конференции. 2017.  С. 166-167.",Киричек Р.В.,,https://www.elibrary.ru/item.asp?id=30368644
95,8596,"АНАЛИЗ ВОЗМОЖНОСТЕЙ ПРИМЕНЕНИЯ SDN/NFV В МОБИЛЬНЫХ СЕТЯХ 5GМухизи С., Киричёк Р.В.



 В книге: Молодежная научная школа по прикладной теории вероятностей и телекоммуникационным технологиям (АPTCT-2017). материалы молодежной научной школы. Российский университет дружбы народов; Под общей редакцией К. Е. Самуйлова, Е. А. Кучерявого, А. Н. Дудина. 2017.  С. 166-174.","Мухизи С., Киричёк Р.В.",,https://www.elibrary.ru/item.asp?id=32565584
96,8597,"ИССЛЕДОВАНИЕ КАЧЕСТВА ВОСПРИЯТИЯ IPTV НА БАЗЕ ПРОГРАММНО-КОНФИГУРИРУЕМОЙ СЕТИ SDNМанарийо С., Маколкина М.А., Мутханна А.С.



 В сборнике: 72-я Всероссийская научно-техническая конференция, посвященная Дню радио. Труды конференции. 2017.  С. 168-169.","Манарийо С., Маколкина М.А., Мутханна А.С.",,https://www.elibrary.ru/item.asp?id=30368946
97,8598,"ПРИЛОЖЕНИЯ ДОПОЛНЕННОЙ РЕАЛЬНОСТИ В ЛЕТАЮЩИХ СЕНСОРНЫХ СЕТЯХКучерявый А.Е., Маколкина М.А., Киричек Р.В.



 В сборнике: Связь в революциях. Революции в связи. Материалы Десятых научных чтений памяти А.С. Попова, посвященных Дню радио - празднику работников всех отраслей связи. 2017.  С. 168-171.","Кучерявый А.Е., Маколкина М.А., Киричек Р.В.",,https://www.elibrary.ru/item.asp?id=32505425
98,8599,"РАЗРАБОТКА ПРОГРАММНОГО ОБЕСПЕЧЕНИЯ УПРАВЛЕНИЯ УСТРОЙСТВАМИ С SPI-ИНТЕРФЕЙСОМ ДЛЯ РЕШЕНИЯ НАУЧНЫХ ЗАДАЧ ПО ИССЛЕДОВАНИЮ БЛОКОВОЙ ПАМЯТИВладимиров С.С., Янковский А.К.



 В сборнике: 72-я Всероссийская научно-техническая конференция, посвященная Дню радио. Труды конференции. 2017.  С. 169-171.","Владимиров С.С., Янковский А.К.",,https://www.elibrary.ru/item.asp?id=30370474
99,8600,"МЕТОД УЛУЧШЕНИЯ СХОДИМОСТИ РЯДА ФУРЬЕ ПЕРЕДАТОЧНОЙ ФУНКЦИИ ОДНОМОДОВОГО ОПТИЧЕСКОГО ВОЛОКНАМатюхин А.Ю., Мельтенисов М.А.



 В сборнике: 72-я Всероссийская научно-техническая конференция, посвященная Дню радио. Труды конференции. 2017.  С. 171-172.","Матюхин А.Ю., Мельтенисов М.А.",,https://www.elibrary.ru/item.asp?id=30370545
100,8601,"APPLICATION OF FUZZY LOGIC FOR IMPLEMENTATION PUMPING EQUIPMENT WITH ACCOUNT ENERGY EFFICIENCYKozlova L.P., Kozlova O.A.



 В сборнике: PROCEEDINGS OF 2017 XX IEEE INTERNATIONAL CONFERENCE ON SOFT COMPUTING AND MEASUREMENTS (SCM). 2017.  С. 171-173.","Kozlova L.P., Kozlova O.A.",,https://www.elibrary.ru/item.asp?id=31048447
101,8602,"ОСНОВНЫЕ ТИПЫ ПЛАТФОРМ ПРОМЫШЛЕННОГО ИНТЕРНЕТА ВЕЩЕЙВласенко Л.А., Киричек Р.В., Кулик В.А.



 В сборнике: Интернет вещей и 5G (INTHITEN 2017). 3-я международная научно-техническая конференция студентов, аспирантов и молодых ученых. Под редакцией А. Е. Кучерявого. 2017.  С. 171-175.","Власенко Л.А., Киричек Р.В., Кулик В.А.",,https://www.elibrary.ru/item.asp?id=32647568
102,8603,"ОБЗОР ВНЕДРЕНИЯ ТЕХНОЛОГИИ SIGFOX В ГОСУДАРСТВЕ ОМАНАль Бахри М.С., Киричек Р.В.



 В сборнике: 72-я Всероссийская научно-техническая конференция, посвященная Дню радио. Труды конференции. 2017.  С. 172-173.","Аль Бахри М.С., Киричек Р.В.",,https://www.elibrary.ru/item.asp?id=30370802
103,8604,"ЭНЕРГОЭФФЕКТИВНОСТЬ И ПОКРЫТИЕ LPWAN (SIGFOX) КАК БАЗОВЫЙ КОМПОНЕНТ ЧЕТВЁРТОЙ ПРОМЫШЛЕННОЙ РЕВОЛЮЦИИАль Б.М.С., Киричек Р.В.



 В книге: Молодежная научная школа по прикладной теории вероятностей и телекоммуникационным технологиям (АPTCT-2017). материалы молодежной научной школы. Российский университет дружбы народов; Под общей редакцией К. Е. Самуйлова, Е. А. Кучерявого, А. Н. Дудина. 2017.  С. 17-22.","Аль Б.М.С., Киричек Р.В.",,https://www.elibrary.ru/item.asp?id=32565571
104,8605,"SOFTWARE-DEFINED ROUTING IN CONVERGENT LTE/WIFI NETWORKSLezhepekov A., Letenko I., Vladyko A.



 В сборнике: Proceedings of the 2017 IEEE Conference of Russian Young Researchers in Electrical and Electronic Engineering (EIConRus). 2017.  С. 173-175.","Lezhepekov A., Letenko I., Vladyko A.",,https://www.elibrary.ru/item.asp?id=29080356
105,8606,"ОБЗОР МЕТОДОВ ПЕРЕДАЧИ ДАННЫХ В УСТРОЙСТВАХ IOTМахмуд О.А., Киричек Р.В.



 В сборнике: 72-я Всероссийская научно-техническая конференция, посвященная Дню радио. Труды конференции. 2017.  С. 174-175.","Махмуд О.А., Киричек Р.В.",,https://www.elibrary.ru/item.asp?id=30370963
106,8607,"ИССЛЕДОВАНИЕ СЕТЕВОЙ БЕЗОПАСНОСТИ БЕСПРОВОДНЫХ ТЕХНОЛОГИЙ СВЯЗИ УСТРОЙСТВ ИНТЕРНЕТА ВЕЩЕЙ В УСЛОВИЯХ ПРЕДНАМЕРЕННЫХ ЭЛЕКТРОМАГНИТНЫХ ВОЗДЕЙСТВИЙРазумов А.А., Киричек Р.В.



 В сборнике: 72-я Всероссийская научно-техническая конференция, посвященная Дню радио. Труды конференции. 2017.  С. 175-176.","Разумов А.А., Киричек Р.В.",,https://www.elibrary.ru/item.asp?id=30378506
107,8608,"ИССЛЕДОВАНИЕ ВОЗМОЖНОСТИ ПЕРЕДАЧИ МУЛЬТИМЕДИА ДАННЫХ НА БАЗЕ ТЕХНОЛОГИИ LORAФам В.Д., Колечкин А.О., Аль-Бахри М.С., Киричек Р.В.



 В сборнике: 72-я Всероссийская научно-техническая конференция, посвященная Дню радио. Труды конференции. 2017.  С. 176-178.","Фам В.Д., Колечкин А.О., Аль-Бахри М.С., Киричек Р.В.",,https://www.elibrary.ru/item.asp?id=30378508
108,8609,"ИССЛЕДОВАНИЕ ПЕРЕДАЧИ ВИДЕО НА БАЗЕ ТЕХНОЛОГИИ IEEE 802.11ADДинь Ч.З., Киричек Р.В.



 В сборнике: Интернет вещей и 5G (INTHITEN 2017). 3-я международная научно-техническая конференция студентов, аспирантов и молодых ученых. Под редакцией А. Е. Кучерявого. 2017.  С. 176-180.","Динь Ч.З., Киричек Р.В.",,https://www.elibrary.ru/item.asp?id=32647569
109,8610,"ПОДХОДЫ К ИССЛЕДОВАНИЮ МЕТОДОВ ИДЕНТИФИКАЦИИ УСТРОЙСТВ И ВИРТУАЛЬНЫХ СУЩНОСТЕЙ ИНТЕРНЕТА ВЕЩЕЙ НА БАЗЕ АРХИТЕКТУРЫ ЦИФРОВЫХ ОБЪЕКТОВМоскаленко Т.А., Бородин А.С., Киричек Р.В.



 В сборнике: 72-я Всероссийская научно-техническая конференция, посвященная Дню радио. Труды конференции. 2017.  С. 178-179.","Москаленко Т.А., Бородин А.С., Киричек Р.В.",,https://www.elibrary.ru/item.asp?id=30465181
110,8611,"ИССЛЕДОВАНИЕ МЕТОДОВ УДАЛЕННОГО КОНТРОЛЯ ЗА IOT-УСТРОЙСТВАМИ НА ОСНОВЕ ОБЛАЧНЫХ ПЛАТФОРМ И РАЗЛИЧНЫХ ПРОТОКОЛОВЛьвова Т.К., Хакимов А.А., Аль Бахри А.С., Мутханна А.С.А., Киричек Р.В.



 В сборнике: 72-я Всероссийская научно-техническая конференция, посвященная Дню радио. Труды конференции. 2017.  С. 179-180.","Львова Т.К., Хакимов А.А., Аль Бахри А.С., Мутханна А.С.А., Киричек Р.В.",,https://www.elibrary.ru/item.asp?id=30466523
111,8612,"ИНФОРМАЦИОННЫЕ ПОТОКИ В БИОЛОГИЧЕСКИХ СИСТЕМАХ: ПОРЯДОК ИЗ ХАОСАГлушаков Р.И., Пирмагомедов Р.Я., Киричек Р.В.



 В сборнике: Интернет вещей и 5G (INTHITEN 2017). 3-я международная научно-техническая конференция студентов, аспирантов и молодых ученых. Под редакцией А. Е. Кучерявого. 2017.  С. 1-8.","Глушаков Р.И., Пирмагомедов Р.Я., Киричек Р.В.",,https://www.elibrary.ru/item.asp?id=32647521
112,8613,"РАЗРАБОТКА АНАЛИТИЧЕСКОЙ МОДЕЛИ СИСТЕМЫ МАССОВОГО ОБСЛУЖИВАНИЯ ДЛЯ ФРАГМЕНТА SDNМухизи С., Киричек Р.В.



 В сборнике: 72-я Всероссийская научно-техническая конференция, посвященная Дню радио. Труды конференции. 2017.  С. 181-182.","Мухизи С., Киричек Р.В.",,https://www.elibrary.ru/item.asp?id=30496667
113,8614,"АНАЛИЗ ИСПОЛЬЗОВАНИЯ ПРОМЫШЛЕННЫХ ПРОТОКОЛОВ В РАМКАХ КОНЦЕПЦИИ ПРОМЫШЛЕННОГО ИНТЕРНЕТА ВЕЩЕЙХабаров И.Е., Киричек Р.В.



 В сборнике: Интернет вещей и 5G (INTHITEN 2017). 3-я международная научно-техническая конференция студентов, аспирантов и молодых ученых. Под редакцией А. Е. Кучерявого. 2017.  С. 181-185.","Хабаров И.Е., Киричек Р.В.",,https://www.elibrary.ru/item.asp?id=32647570
114,8615,"DETECTION OF STEGOSYSTEMS USING BLOCK CIPHERS FOR ENCRYPTION OF THE EMBEDDED MESSAGESKorzhik V., Fedyanin I., Nguyen C.D.



 В сборнике: 20th Conference of Open Innovations Association FRUCT. Proceedings. LETI University, St.Petersburg, Russia; S. Balandin, A. Levina, T. Tyutina. 2017.  С. 181-186.","Korzhik V., Fedyanin I., Nguyen C.D.",,https://www.elibrary.ru/item.asp?id=35015754
115,8616,"ТЕХНОЛОГИЯ X-ETHERNET С УЛЬТРА МАЛЫМИ ЗАДЕРЖКАМИ ДЛЯ СЕТЕЙ 5GМуратов Э.М., Мутханна А.С., Киричек Р.В., Кучерявый А.Е.



 В сборнике: 72-я Всероссийская научно-техническая конференция, посвященная Дню радио. Труды конференции. 2017.  С. 182-183.","Муратов Э.М., Мутханна А.С., Киричек Р.В., Кучерявый А.Е.",,https://www.elibrary.ru/item.asp?id=30496829
116,8617,"КОМПЬЮТЕРНАЯ МОДЕЛЬ УСИЛИТЕЛЯ EDFA С НЕСКОЛЬКИМИ ИСТОЧНИКАМИ СИГНАЛОВ И НАКАЧЕКБылина М.С., Чаймарданов П.А.



 В сборнике: VI МЕЖДУНАРОДНАЯ КОНФЕРЕНЦИЯ ПО ФОТОНИКЕ И ИНФОРМАЦИОННОЙ ОПТИКЕ. сборник научных трудов
. 2017.  С. 183-184.","Былина М.С., Чаймарданов П.А.",,https://www.elibrary.ru/item.asp?id=29719025
117,8618,"ВИРТУАЛЬНЫЕ МОДЕЛЬНЫЕ СЕТИ НА БАЗЕ ЭМУЛЯТОРА UNETLABЗахаров М.В., Киричек Р.В., Кучерявый А.Е.



 В сборнике: 72-я Всероссийская научно-техническая конференция, посвященная Дню радио. Труды конференции. 2017.  С. 183-185.","Захаров М.В., Киричек Р.В., Кучерявый А.Е.",,https://www.elibrary.ru/item.asp?id=30496810
118,8619,"HIGH-LEVEL VULNERABILITIES OF SOFTWARE-DEFINED NETWORKING IN THE CONTEXT OF TELECOMMUNICATION NETWORK EVOLUTIONMostovich D., Fabrikantov P., Vladyko A., Buinevich M.



 В сборнике: Proceedings of the 2017 IEEE Conference of Russian Young Researchers in Electrical and Electronic Engineering (EIConRus). 2017.  С. 184-186.","Mostovich D., Fabrikantov P., Vladyko A., Buinevich M.",,https://www.elibrary.ru/item.asp?id=29080396
119,8620,"ИССЛЕДОВАНИЕ ВЗАИМОДЕЙСТВИЯ ПРОГРАММНО-КОНФИГУРИРУЕМЫХ СЕТЕЙ С РАЗЛИЧНЫМИ ПРОТОКОЛАМИ МАРШРУТИЗАЦИИПарпиев Р.У., Мутханна А.С.А., Киричек Р.В., Владыко А.Г.



 В сборнике: 72-я Всероссийская научно-техническая конференция, посвященная Дню радио. Труды конференции. 2017.  С. 185-186.","Парпиев Р.У., Мутханна А.С.А., Киричек Р.В., Владыко А.Г.",,https://www.elibrary.ru/item.asp?id=30497162
120,8621,"МЕТОД РЕГУЛИРОВАНИЯ ВОЗДУШНОГО ДВИЖЕНИЯ БПЛА В УМНЫХ ГОРОДАХ И СООБЩЕСТВАХБондарев А.Н., Бородин А.С., Киричек Р.В.



 В сборнике: 72-я Всероссийская научно-техническая конференция, посвященная Дню радио. Труды конференции. 2017.  С. 186-188.","Бондарев А.Н., Бородин А.С., Киричек Р.В.",,https://www.elibrary.ru/item.asp?id=30497662
121,8622,"ОСОБЕННОСТИ РЕАЛИЗАЦИИ И ПЕРСПЕКТИВЫ РАЗВИТИЯ ТЕХНОЛОГИИ MASSIVE MIMO В СЕТЯХ 5GЛазарев В.О., Фокин Г.А.



 В сборнике: Интернет вещей и 5G (INTHITEN 2017). 3-я международная научно-техническая конференция студентов, аспирантов и молодых ученых. Под редакцией А. Е. Кучерявого. 2017.  С. 186-190.","Лазарев В.О., Фокин Г.А.",,https://www.elibrary.ru/item.asp?id=32647571
122,8623,"CONSTRUCTION OF ONTOLOGY OF PROBLEM AREA BASED ON THE SYNTAGMATIC ANALYSIS OF TEXT DOCUMENTSZarubin A.A., Koval A.R., Moshkin V.S., Filippov A.A.



 В сборнике: Информационные технологии и нанотехнологии (ИТНТ-2017). сборник трудов III международной конференции и молодежной школы. Самарский национальный исследовательский университет имени академика С.П. Королева. 2017.  С. 1862-1867.","Zarubin A.A., Koval A.R., Moshkin V.S., Filippov A.A.",,https://www.elibrary.ru/item.asp?id=29267065
123,8624,"МЕТОД КОНФИГУРОВАНИЯ БУФЕРА OPENFLOW КОММУТАТОРАХакимов А.А., Мутханна А.С., Киричек Р.В., Владыко А.Г.



 В сборнике: 72-я Всероссийская научно-техническая конференция, посвященная Дню радио. Труды конференции. 2017.  С. 188-189.","Хакимов А.А., Мутханна А.С., Киричек Р.В., Владыко А.Г.",,https://www.elibrary.ru/item.asp?id=30497888
124,8625,"ИССЛЕДОВАНИЕ КАЧЕСТВА ОБСЛУЖИВАНИЯ ТРАФИКА ПРОГРАММНО-КОНФИГУРИРУЕМОЙ СЕТИ НА БАЗЕ СИМУЛЯТОРА GNS3Шинкарев А.С., Мутханна А.С., Киричек Р.В.



 В сборнике: 72-я Всероссийская научно-техническая конференция, посвященная Дню радио. Труды конференции. 2017.  С. 189-190.","Шинкарев А.С., Мутханна А.С., Киричек Р.В.",,https://www.elibrary.ru/item.asp?id=30497906
125,8626,"ПРОБЛЕМЫ ЗАЩИТЫ ИНФОРМАЦИОННО-ТЕЛЕКОММУНИКАЦИОННОЙ ИНФРАСТРУКТУРЫ РФ ОТ КИБЕРАТАКМошак Н.Н., Евсейко К.В.



 В книге: Информационная безопасность регионов России (ИБРР-2017). Материалы конференции. 2017.  С. 190-191.","Мошак Н.Н., Евсейко К.В.",,https://www.elibrary.ru/item.asp?id=32757178
126,8627,"ИССЛЕДОВАНИЕ ТЕХНОЛОГИЙ WLAN ДЛЯ ПОСТРОЕНИЯ КЛАСТЕРОВ В СЕТЯХ 5GХуссейн О.А., Парамонов А.И.



 В сборнике: 72-я Всероссийская научно-техническая конференция, посвященная Дню радио. Труды конференции. 2017.  С. 190-192.","Хуссейн О.А., Парамонов А.И.",,https://www.elibrary.ru/item.asp?id=30504518
127,8628,"SOFTWARE DEVELOPMENT FOR THE CENTRALIZED MANAGEMENT OF IOT-DEVICES IN THE ""SMART HOME"" SYSTEMSMuthanna A., Gimadinov R., Kirichek R., Koucheryavy A., Muthanna M.S.A.



 В сборнике: Proceedings of the 2017 IEEE Conference of Russian Young Researchers in Electrical and Electronic Engineering (EIConRus). 2017.  С. 190-194.","Muthanna A., Gimadinov R., Kirichek R., Koucheryavy A., Muthanna M.S.A.",,https://www.elibrary.ru/item.asp?id=29080359
128,8629,"ПРОГРАММНО-КОНФИГУРИРУЕМЫЕ МУЛЬТИОБЛАКА ДЛЯ ПРИЛОЖЕНИЙ ТАКТИЛЬНОГО ИНТЕРНЕТААль Балюши М.М., Киричек Р.В.



 В сборнике: Интернет вещей и 5G (INTHITEN 2017). 3-я международная научно-техническая конференция студентов, аспирантов и молодых ученых. Под редакцией А. Е. Кучерявого. 2017.  С. 191-196.","Аль Балюши М.М., Киричек Р.В.",,https://www.elibrary.ru/item.asp?id=32647572
129,8630,"ИССЛЕДОВАНИЕ СИСТЕМЫ E-ЗДОРОВЬЯ НА ОСНОВЕ WEB-ВЕЩЕЙИванова О.В., Хакимов А.А., Мутханна А.С.А., Пирмагомедов Р.Я.



 В сборнике: 72-я Всероссийская научно-техническая конференция, посвященная Дню радио. Труды конференции. 2017.  С. 192-193.","Иванова О.В., Хакимов А.А., Мутханна А.С.А., Пирмагомедов Р.Я.",,https://www.elibrary.ru/item.asp?id=30504572
130,8631,"ИССЛЕДОВАНИЕ АЛГОРИТМОВ ОПТИМАЛЬНОГО ФОРМИРОВАНИЯ ГРУПП УСТРОЙСТВ ДЛЯ D2D СОЕДИНЕНИЙТесленко М.В., Атея А.А., Мутханна А.С.А.



 В сборнике: 72-я Всероссийская научно-техническая конференция, посвященная Дню радио. Труды конференции. 2017.  С. 193-194.","Тесленко М.В., Атея А.А., Мутханна А.С.А.",,https://www.elibrary.ru/item.asp?id=30504629
131,8632,"ВОССТАНОВЛЕНИЕ СВЯЗНОСТИ БЕСПРОВОДНОЙ СЕНСОРНОЙ СЕТИНуриллоев И.Н., Парамонов А.И.



 В сборнике: 72-я Всероссийская научно-техническая конференция, посвященная Дню радио. Труды конференции. 2017.  С. 195-196.","Нуриллоев И.Н., Парамонов А.И.",,https://www.elibrary.ru/item.asp?id=30505745
132,8633,"RESULTS PROCESSING OF QUALITY CHARACTERISTICS MEASUREMENTS OF DRM SIGNALMyshyanov S.V., Sabanova A.I., Kovalgin Yu.A.



 В сборнике: Proceedings of the 2017 IEEE Conference of Russian Young Researchers in Electrical and Electronic Engineering (EIConRus). 2017.  С. 195-197.","Myshyanov S.V., Sabanova A.I., Kovalgin Yu.A.",,https://www.elibrary.ru/item.asp?id=29080395
133,8634,"ИССЛЕДОВАНИЕ ДЛИТЕЛЬНОСТЕЙ ПОЛЬЗОВАТЕЛЬСКИХ СЕССИЙ В СЕТИ БЕСПРОВОДНОГО ДОСТУПАВикулов А.С., Парамонов А.И.



 В сборнике: 72-я Всероссийская научно-техническая конференция, посвященная Дню радио. Труды конференции. 2017.  С. 196-197.","Викулов А.С., Парамонов А.И.",,https://www.elibrary.ru/item.asp?id=30505904
134,8635,"ПРИМЕНЕНИЕ МЕТОДОВ КЛАСТЕРИЗАЦИИ ДЛЯ ВЫБОРА ГОЛОВНОГО УЗЛА В ГРУППЕ БПЛАДао Ч.Н., Парамонов А.И.



 В сборнике: 72-я Всероссийская научно-техническая конференция, посвященная Дню радио. Труды конференции. 2017.  С. 197-199.","Дао Ч.Н., Парамонов А.И.",,https://www.elibrary.ru/item.asp?id=30505814
