,number,title,authors,info,url
176,8677,"THE USE OF A MATRIX DECOMPOSITIONS FOR DIMENSION REDUCTION OF TRAINING SAMPLELitvinov V.L., Kozlova L.P., Filippov F.V.



 В сборнике: 2017 IEEE II International Conference on Control in Technical Systems (CTS). Dr. Mikhail Shestopalov; Co-chair of the Conference Organizing Committee, Chair of the IEEE Russia NW Section; Vice Rector for Research, Saint Petersburg Electrotechnical University “LETI”. 2017.  С. 282-284.","Litvinov V.L., Kozlova L.P., Filippov F.V.",,https://www.elibrary.ru/item.asp?id=35112117
177,8678,"РАЗРАБОТКА ПРОГРАММНОГО ОБЕСПЕЧЕНИЯ ДЛЯ ИМИТАЦИОННОГО МОДЕЛИРОВАНИЯ ВОЛОКОННО-ОПТИЧЕСКИХ СИСТЕМ ПЕРЕДАЧИЧаймарданов П.А.



 В сборнике: Наука и инновации в технических университетах. материалы Одиннадцатого Всероссийского форума студентов, аспирантов и молодых ученых. Санкт-Петербургский политехнический университет Петра Великого. 2017.  С. 28-30.",Чаймарданов П.А.,,https://www.elibrary.ru/item.asp?id=32510225
178,8679,"ИНВЕРТОР ПРОМЫШЛЕННОЙ ЧАСТОТЫ, РАБОТАЮЩИЙ ОТ НИЗКОГО НАПРЯЖЕНИЯ ПИТАНИЯДмитриков В.Ф., Антоневич Н.В., Шушпанов Д.В.



 В сборнике: II Научный форум телекоммуникации: теория и технологии ТТТ-2017. Физика и технические приложения волновых процессов ФиТПВП-2017. Материалы XV Международной научно-технической конференции. Под редакцией О.И. Антипова. 2017.  С. 283-284.","Дмитриков В.Ф., Антоневич Н.В., Шушпанов Д.В.",,https://www.elibrary.ru/item.asp?id=35226624
179,8680,"ИСХОДНЫЕ ДАННЫЕ ДЛЯ ПОСТРОЕНИЯ ВОЛОКОННО-ОПТИЧЕСКОЙ ЛИНИИ СВЯЗИ НА ПОДВОДНОМ УЧАСТКЕ АРКТИЧЕСКОЙ ЗОНЫСкрипник И.Л., Воронин С.В., Стахеев И.Г.



 В сборнике: СЕРВИС БЕЗОПАСНОСТИ В РОССИИ: ОПЫТ, ПРОБЛЕМЫ, ПЕРСПЕКТИВЫ. ОБЕСПЕЧЕНИЕ КОМПЛЕКСНОЙ БЕЗОПАСНОСТИ ЖИЗНЕДЕЯТЕЛЬНОСТИ НАСЕЛЕНИЯ. материалы IX Всероссийской научно-практической конференции. Санкт-Петербургский университет Государственной противопожарной службы МЧС России. 2017.  С. 287-289.","Скрипник И.Л., Воронин С.В., Стахеев И.Г.",,https://www.elibrary.ru/item.asp?id=32592694
180,8681,"IMPLEMENTATION OF ARTIFICIAL NEURAL NETWORKS PERFORMING BASIC LOGIC OPERATIONS ON MICROCONTROLLER WITH ULTRALOW POWER CONSUMPTIONGrineva A.K., Zhukovskii I.I., Stepanov A.B.



 В сборнике: 2017 IEEE II International Conference on Control in Technical Systems (CTS). Dr. Mikhail Shestopalov; Co-chair of the Conference Organizing Committee, Chair of the IEEE Russia NW Section; Vice Rector for Research, Saint Petersburg Electrotechnical University “LETI”. 2017.  С. 289-292.","Grineva A.K., Zhukovskii I.I., Stepanov A.B.",,https://www.elibrary.ru/item.asp?id=35112139
181,8682,"УЛЬТРАФИЛЬТРАЦИЯ КОМПЛЕКСНЫХ СОЕДИНЕНИЙ СЕРЕБРА ПРИ ПЕРЕРАБОТКЕ ЭЛЕКТРОННЫХ ОТХОДОВКун Н.Ю., Владимирова Е.С.



 В сборнике: Сборник научных трудов молодых ученых, аспирантов, студентов и преподавателей по результатам проведения VIII молодежного экологического Конгресса ""Северная Пальмира"". Материалы конгресса. 2017.  С. 291-294.","Кун Н.Ю., Владимирова Е.С.",,https://www.elibrary.ru/item.asp?id=36658222
182,8683,"АРХИТЕКТУРА ПРОГРАММНО-АППАРАТНОГО КОМПЛЕКСА ИДЕНТИФИКАЦИИ УСТРОЙСТВ ИНТЕРНЕТА ВЕЩЕЙ С ПОМОЩЬЮ ДОПОЛНЕННОЙ РЕАЛЬНОСТИТельтевская В.А., Маколкина М.А., Киричек Р.В.



 В книге: Молодежная научная школа по прикладной теории вероятностей и телекоммуникационным технологиям (АPTCT-2017). материалы молодежной научной школы. Российский университет дружбы народов; Под общей редакцией К. Е. Самуйлова, Е. А. Кучерявого, А. Н. Дудина. 2017.  С. 295-298.","Тельтевская В.А., Маколкина М.А., Киричек Р.В.",,https://www.elibrary.ru/item.asp?id=32565582
183,8684,"КОМПЬЮТЕРНОЕ МОДЕЛИРОВАНИЕ В СРЕДЕ ANYLOGICБоев В.Д.



Учебное пособие /  Сер.  68 Профессиональное образование.  (1-е изд.)  Москва, 2017.",Боев В.Д.,,https://www.elibrary.ru/item.asp?id=30572670
184,8685,"КОНЦЕПЦИЯ ПОЛИГОНА СЕТЕВОЙ МЕЖОБЪЕКТОВОЙ ОТРАБОТКИ ТЕХНОЛОГИЙ УПРАВЛЕНИЯ И ОБЕСПЕЧЕНИЯ ПРЕВОСХОДСТВА В ИНФОСФЕРЕАлексеев А.В., Барабаш П.А., Жигадло В.Э., Зикратов И.А., Нырков А.П.



 В книге: Информационная безопасность регионов России (ИБРР-2017). Материалы конференции. 2017.  С. 304-306.","Алексеев А.В., Барабаш П.А., Жигадло В.Э., Зикратов И.А., Нырков А.П.",,https://www.elibrary.ru/item.asp?id=32758742
185,8686,"APPLICATION OF FUZZY LOGIC TO CONTROL PUMPING EQUIPMENTKozlova L.P., Kozlova O.A.



 В сборнике: 2017 IEEE II International Conference on Control in Technical Systems (CTS). Dr. Mikhail Shestopalov; Co-chair of the Conference Organizing Committee, Chair of the IEEE Russia NW Section; Vice Rector for Research, Saint Petersburg Electrotechnical University “LETI”. 2017.  С. 304-306.","Kozlova L.P., Kozlova O.A.",,https://www.elibrary.ru/item.asp?id=35112152
186,8687,"КОМПЛЕКСНЫЙ ПОДХОД К СОВЕРШЕНСТВОВАНИЮ МЕТОДОВ КОНТРОЛЯ И ПРОГНОЗИРОВАНИЯ НЕГАТИВНОГО ВОЗДЕЙСТВИЯ АВТОМОБИЛЬНОГО И ВОДНОГО ТРАНСПОРТА НА ГОРОДСКУЮ СРЕДУЛожкина О.В., Рогозинский Г.Г., Ложкин В.Н.



 В сборнике: Транспорт России: проблемы и перспективы - 2017. Материалы Международной научно-практической конференции. ФГБУН Институт проблем транспорта им. Н.С. Соломенко Российской академии наук. 2017.  С. 304-309.","Ложкина О.В., Рогозинский Г.Г., Ложкин В.Н.",,https://www.elibrary.ru/item.asp?id=31746997
187,8688,"ОПЫТ ИСПОЛЬЗОВАНИЯ ИЗМЕРИТЕЛЬНЫХ ПРИЕМНИКОВ EB500 В КОМПЛЕКСАХ РАДИОКОНТРОЛЯ НА ПРЕДПРИЯТИЯХ РАДИОЧАСТОТНОЙ СЛУЖБЫАнтипин Б.М., Грачев В.О., Кулагин В.С., Мартиросова Н.Р.



 В сборнике: 72-я Всероссийская научно-техническая конференция, посвященная Дню радио. Труды конференции. 2017.  С. 312-313.","Антипин Б.М., Грачев В.О., Кулагин В.С., Мартиросова Н.Р.",,https://www.elibrary.ru/item.asp?id=30591370
188,8689,"СРЕДСТВА АНАЛИЗА ЭМС В РАБОТЕ РАДИОЧАСТОТНОЙ СЛУЖБЫВиноградов Е.М.



 В сборнике: 72-я Всероссийская научно-техническая конференция, посвященная Дню радио. Труды конференции. 2017.  С. 313-315.",Виноградов Е.М.,,https://www.elibrary.ru/item.asp?id=30591390
189,8690,"ТЕОРИЯ ОДНОПОЗИЦИОННОЙ ЭНЕРГЕТИЧЕСКОЙ КООРДИНАТОМЕТРИИ ИСТОЧНИКОВ РАДИОИЗЛУЧЕНИЯЛогинов Ю.И., Спирин А.Д.



 В сборнике: 72-я Всероссийская научно-техническая конференция, посвященная Дню радио. Труды конференции. 2017.  С. 320-321.","Логинов Ю.И., Спирин А.Д.",,https://www.elibrary.ru/item.asp?id=30591400
190,8691,"ПОДХОДЫ К ПОИСКУ ОПТИМАЛЬНОГО АЛГОРИТМА ОПРЕДЕЛЕНИЯ МЕСТОПОЛОЖЕНИЯ ИСТОЧНИКОВ РАДИОИЗЛУЧЕНИЯСпирин А.Д.



 В сборнике: 72-я Всероссийская научно-техническая конференция, посвященная Дню радио. Труды конференции. 2017.  С. 321-322.",Спирин А.Д.,,https://www.elibrary.ru/item.asp?id=30591406
191,8692,"ОБОБЩЕННЫЙ КОНСТРУКТИВНЫЙ АЛГОРИТМ ПРЕОБРАЗОВАНИЯ ИНВЕРСИИ ОТНОСИТЕЛЬНО ОКРУЖНОСТИВолошинов Д.В., Казначеева Е.С., Хайбарахманова Е.С.



 В сборнике: GraphiCon 2017. Труды 27-й Международной конференции  по компьютерной графике и машинному зрению. Пермский государственный национальный исследовательский университет. 2017.  С. 346-349.","Волошинов Д.В., Казначеева Е.С., Хайбарахманова Е.С.",,https://www.elibrary.ru/item.asp?id=35157522
192,8693,"АСИМПТОТИЧЕСКАЯ МОДЕЛЬ СБАЛАНСИРОВАННОЙ IP-СЕТИ С РАСПРЕДЕЛЕННОЙ СТРУКТУРОЙКутбитдинов С.Ш., Лохмотко В.В.



 В книге: Информационно-телекоммуникационные технологии и математическое моделирование высокотехнологичных систем. Материалы Всероссийской конференции с международным участием. 2017.  С. 35-37.","Кутбитдинов С.Ш., Лохмотко В.В.",,https://www.elibrary.ru/item.asp?id=29991398
193,8694,"THE USE OF UAVS, SDN, AND AUGMENTED REALITY FOR VANET APPLICATIONSMakolkina M., Paramonov A., Vladyko A., Dunaytsev R., Kirichek R., Koucheryavy A.



 В сборнике: 3rd International Conference on Artificial Intelligence and Industrial Engineering (AIIE 2017). Сер. ""DEStech Transactions on Computer Science and Engineering"" 2017.  С. 364-368.","Makolkina M., Paramonov A., Vladyko A., Dunaytsev R., Kirichek R., Koucheryavy A.",,https://www.elibrary.ru/item.asp?id=32454704
194,8695,"ОСОБЕННОСТИ ИНФОРМАЦИОННО-ПСИХОЛОГИЧЕСКОГО ВОЗДЕЙСТВИЯ В ИНТЕРНЕТЕЛевкин И.М., Науменко К.А., Виткова Л.А.



 В книге: Информационная безопасность регионов России (ИБРР-2017). Материалы конференции. 2017.  С. 365-367.","Левкин И.М., Науменко К.А., Виткова Л.А.",,https://www.elibrary.ru/item.asp?id=32759312
195,8696,"НОВАЯ МЕТОДИКА РАСЧЕТА ОПТИЧЕСКОГО УСИЛИТЕЛЯ EDFA НА ОСНОВЕ ВОЛОКНА, ЛЕГИРОВАННОГО ИОНАМИ ЭРБИЯЧаймарданов П.А.



 В сборнике: VI МЕЖДУНАРОДНАЯ КОНФЕРЕНЦИЯ ПО ФОТОНИКЕ И ИНФОРМАЦИОННОЙ ОПТИКЕ. сборник научных трудов
. 2017.  С. 366-367.",Чаймарданов П.А.,,https://www.elibrary.ru/item.asp?id=29719115
196,8697,"ПРОТОКОЛ ОДНОГО СОВЕЩАНИЯ: ИЗ ОПЫТА РАБОТЫ УНИВЕРСИТЕТСКОГО УЧЕБНОГО ОКРУГАГенкин А.Л., Кипнес Л.В.



 В сборнике: Университетский комплекс как региональный центр образования, науки и культуры. материалы Всероссийской научно-методической конференции. Оренбургский государственный университет. 2017.  С. 3667-3670.","Генкин А.Л., Кипнес Л.В.",,https://www.elibrary.ru/item.asp?id=28977567
197,8698,"THE SOLUTION OF THE INFORMATION TASKS USING FUZZY METHODSKozlova O.A., Kozlova L.P.



 В сборнике: 2017 IEEE II International Conference on Control in Technical Systems (CTS). Dr. Mikhail Shestopalov; Co-chair of the Conference Organizing Committee, Chair of the IEEE Russia NW Section; Vice Rector for Research, Saint Petersburg Electrotechnical University “LETI”. 2017.  С. 367-369.","Kozlova O.A., Kozlova L.P.",,https://www.elibrary.ru/item.asp?id=35112166
198,8699,"CONSTRUCTION OF ACTIVATION FUNCTIONS FOR WAVELET NEURAL NETWORKSStepanov A.B.



 В сборнике: PROCEEDINGS OF 2017 XX IEEE INTERNATIONAL CONFERENCE ON SOFT COMPUTING AND MEASUREMENTS (SCM). 2017.  С. 397-399.",Stepanov A.B.,,https://www.elibrary.ru/item.asp?id=29652554
199,8700,"ТРАНСФОРМАЦИЯ МОДЕЛИ ИННОВАЦИОННОГО ПРОЦЕССА НА ПРЕДПРИЯТИЯХ С РАЗВИТИЕМ ИНФОКОММУНИКАЦИОННЫХ ТЕХНОЛОГИЙКваша Н.В., Демиденко Д.С., Ворошин Е.А.



 В сборнике: Промышленная политика в цифровой экономике: проблемы и перспективы. Труды научно-практической конференции с международным участием. Под ред. А.В. Бабкина. 2017.  С. 398-404.","Кваша Н.В., Демиденко Д.С., Ворошин Е.А.",,https://www.elibrary.ru/item.asp?id=32394858
200,8701,"5.6. К ВОПРОСУ О РЕЗУЛЬТАТАХ ИССЛЕДОВАНИЯ МЕЖКУЛЬТУРНОЙ ЛИЧНОСТИ СТУДЕНТОВ ТЕХНИЧЕСКИХ ВУЗОВЖелтова Е.П., Сарапулова А.В.



 В книге: Высшая школа в России и за рубежом: проблемы и их решения.  Нагорнова А.Ю., Арпентьева М.Р., Алексеева И.А., Крейк А.И., Карелин В.М., Васильев П.В., Капустина В.А., Козлова Ю.А., Черникова В.Е., Левочкина Н.А., Меликсетян С.Н., Матвиенко Л.М., Нестеренко В.Г., Ирхина И.В., Сухова Е.Е., Газизова А.И., Абылкасымова А.Е., Шерьязданова Г.Р., Локтева А.И., Родионова М.Е. и др. коллективная монография. Ульяновск, 2017.  С. 400-409.","Желтова Е.П., Сарапулова А.В.",,https://www.elibrary.ru/item.asp?id=28336209
201,8702,"СПЕЦИАЛЬНЫЕ КИХ-ФИЛЬТРЫ С АНТИСИММЕТРИЧНОЙ ИМПУЛЬСНОЙ ХАРАКТЕРИСТИКОЙ И ИХ МОДЕЛИРОВАНИЕ В MATLABСолонина А.И.



 В сборнике: 72-я Всероссийская научно-техническая конференция, посвященная Дню радио. Труды конференции. 2017.  С. 40-41.",Солонина А.И.,,https://www.elibrary.ru/item.asp?id=30366541
202,8703,"ВЛИЯНИЕ ЭЛЕКТРОМАГНИТНЫХ ПОЛЕЙ СЛАБОЙ ИНТЕНСИВНОСТИ НА КАЧЕСТВО СНА У ПАЦИЕНТОВ С ИНСОМНИЕЙЯворский А.Б., Крыжановский Э.В., Левушкин С.П., Мещеряков А.В.



 В сборнике: Теоретические и практические аспекты здорового образа жизни. Материалы 2-й международной научно-практической конференции. Одесса, 2017.  С. 40-44.","Яворский А.Б., Крыжановский Э.В., Левушкин С.П., Мещеряков А.В.",,https://www.elibrary.ru/item.asp?id=50742765
203,8704,"ИСКУССТВЕННЫЕ НЕЙРОННЫЕ СЕТИ В MATLABПомогалова А.В., Степанов А.Б.



 В сборнике: 72-я Всероссийская научно-техническая конференция, посвященная Дню радио. Труды конференции. 2017.  С. 42-43.","Помогалова А.В., Степанов А.Б.",,https://www.elibrary.ru/item.asp?id=30366699
204,8705,"ПЕРЕВОД КАК ПОЛНОПРАВНЫЙ ВИД РЕЧЕВОЙ ДЕЯТЕЛЬНОСТИ ПРИ ОБУЧЕНИИ ИНОСТРАННОМУ ЯЗЫКУ СТУДЕНТОВ ТЕХНИЧЕСКОГО ВУЗАКузьмина А.В.



 В сборнике: Инновационные идеи и подходы к интегрированному обучению иностранным языкам и профессиональным дисциплинам в системе высшего образования. материалы международной школы-конференции. 2017.  С. 42-45.",Кузьмина А.В.,,https://www.elibrary.ru/item.asp?id=30456606
205,8706,"ФУНКЦИИ ИНТЕГРАТИВНОГО ПОИСКА ВУЗОВСКИХ БИБЛИОТЕЧНЫХ ПОРТАЛОВ,ПОСТРОЕННЫХ НА ОСНОВЕ J-ИРБИС 2.0Соколинский К.Е., Крылова Е.В.



 В сборнике: КНИГА. КУЛЬТУРА. ОБРАЗОВАНИЕ. ИННОВАЦИИ ""КРЫМ-2017"". Материалы Третьего Международного профессионального форума. Государственная публичная научно-техническая библиотека России. 2017.  С. 42-46.","Соколинский К.Е., Крылова Е.В.",,https://www.elibrary.ru/item.asp?id=32396474
206,8707,"ВЫСШАЯ ШКОЛА В РОССИИ И ЗА РУБЕЖОМ: ПРОБЛЕМЫ И ИХ РЕШЕНИЯНагорнова А.Ю., Арпентьева М.Р., Алексеева И.А., Крейк А.И., Карелин В.М., Васильев П.В., Капустина В.А., Козлова Ю.А., Черникова В.Е., Левочкина Н.А., Меликсетян С.Н., Матвиенко Л.М., Нестеренко В.Г., Ирхина И.В., Сухова Е.Е., Газизова А.И., Абылкасымова А.Е., Шерьязданова Г.Р., Локтева А.И., Родионова М.Е. и др.



коллективная монография /  Ульяновск, 2017.","Нагорнова А.Ю., Арпентьева М.Р., Алексеева И.А., Крейк А.И., Карелин В.М., Васильев П.В., Капустина В.А., Козлова Ю.А., Черникова В.Е., Левочкина Н.А., Меликсетян С.Н., Матвиенко Л.М., Нестеренко В.Г., Ирхина И.В., Сухова Е.Е., Газизова А.И., Абылкасымова А.Е., Шерьязданова Г.Р., Локтева А.И., Родионова М.Е. и др.",,https://www.elibrary.ru/item.asp?id=28336164
207,8708,"РЕАЛИЗАЦИЯ ИСКУССТВЕННЫХ НЕЙРОННЫХ СЕТЕЙ НА МИКРОКОНТРОЛЛЕРЕ MSP430G2XГринёва А.К., Жуковский И.И., Степанов А.Б.



 В сборнике: 72-я Всероссийская научно-техническая конференция, посвященная Дню радио. Труды конференции. 2017.  С. 43-44.","Гринёва А.К., Жуковский И.И., Степанов А.Б.",,https://www.elibrary.ru/item.asp?id=30367175
208,8709,"WAVELET ANALYSIS OF COMPRESSED BIOMEDICAL SIGNALSStepanov A.B.



 В сборнике: 20th Conference of Open Innovations Association FRUCT. Proceedings. LETI University, St.Petersburg, Russia; S. Balandin, A. Levina, T. Tyutina. 2017.  С. 434-440.",Stepanov A.B.,,https://www.elibrary.ru/item.asp?id=35015686
209,8710,"МОДЕЛИРОВАНИЕ ВЕЙВЛЕТ-НЕЙРОННЫХ СЕТЕЙ В MATLABСтепанов А.Б.



 В сборнике: 72-я Всероссийская научно-техническая конференция, посвященная Дню радио. Труды конференции. 2017.  С. 44-45.",Степанов А.Б.,,https://www.elibrary.ru/item.asp?id=30367446
210,8711,"MULTI-ASPECT MODELING SYSTEM OBJECTS IN CALSVerkhova G.V., Akimov S.V.



 В сборнике: PROCEEDINGS OF 2017 XX IEEE INTERNATIONAL CONFERENCE ON SOFT COMPUTING AND MEASUREMENTS (SCM). 2017.  С. 449-451.","Verkhova G.V., Akimov S.V.",,https://www.elibrary.ru/item.asp?id=29651802
211,8712,"THE UNIVERSAL MODEL OF THE AMPLIFIER TWO-PORT CIRCUIT FOR STRUCTURAL-PARAMETRIC SYNTHESIS OF MICROWAVE TRANSISTOR AMPLIFIERSVerkhova G.V., Akimov S.V.



 В сборнике: PROCEEDINGS OF 2017 XX IEEE INTERNATIONAL CONFERENCE ON SOFT COMPUTING AND MEASUREMENTS (SCM). 2017.  С. 452-454.","Verkhova G.V., Akimov S.V.",,https://www.elibrary.ru/item.asp?id=29651801
212,8713,"ЭЛЕКТРОМАГНИТНЫЕ ПОЛЯ КАК ФАКТОР ОКРУЖАЮЩЕЙ СРЕДЫ И ОБЪЕКТ ИНЖЕНЕРНО-ЭКОЛОГИЧЕСКИХ ИЗЫСКАНИЙСтурман В.И.



 В книге: Инженерно–экологические изыскания – нормативно–правовая база, современные методы и оборудование. Тезисы докладов Второй научно-практической конференций. 2017.  С. 45-48.",Стурман В.И.,,https://www.elibrary.ru/item.asp?id=30570815
213,8714,"ПРИМЕНЕНИЕ SIMULINK ДЛЯ МОДЕЛИРОВАНИЯ ДИНАМИЧЕСКИХ ПРОЦЕССОВЖолдасов М.Ж., Степанов А.Б.



 В сборнике: 72-я Всероссийская научно-техническая конференция, посвященная Дню радио. Труды конференции. 2017.  С. 46-47.","Жолдасов М.Ж., Степанов А.Б.",,https://www.elibrary.ru/item.asp?id=30367469
214,8715,"МОДЕЛИРОВАНИЕ В MATLAB ТЕПЛОВЫХ И ЭЛЕКТРИЧЕСКИХ ПРОЦЕССОВ В ТЕХНОЛОГИЧЕСКОЙ СХЕМЕ ПАРОВОЙ ТУРБИНЫРысбек М.Б., Степанов А.Б.



 В сборнике: 72-я Всероссийская научно-техническая конференция, посвященная Дню радио. Труды конференции. 2017.  С. 47-48.","Рысбек М.Б., Степанов А.Б.",,https://www.elibrary.ru/item.asp?id=30367571
215,8716,"ВЗАИМООТНОШЕНИЯ СВЕТСКОЙ И ДУХОВНОЙ ВЛАСТИ В РУССКОЙ ИСТОРИИМаняхина М.Р.



 В сборнике: Святитель Иннокентий (Вениаминов) и научно-просветительская деятельность православного духовенства в Сибири и на Дальнем Востоке XIX - начала XX века. Материалы IV межрегиональной научно-практической конференции. ГБУК Иркутская областная государственная универсальная научная библиотека им. И.И. Молчанова-Сибирского; Составитель, научный редактор С. В. Мельникова. 2017.  С. 47-54.",Маняхина М.Р.,,https://www.elibrary.ru/item.asp?id=32256226
216,8717,"ОБ ОРГАНИЗАЦИИ МОБИЛЬНОЙ СВЯЗИ В МЕСТАХ НЕУВЕРЕННОГО ПРИЁМАЛиконцев А.Н., Шахобиддинов А.Ш.



 В сборнике: 72-я Всероссийская научно-техническая конференция, посвященная Дню радио. Труды конференции. 2017.  С. 48-49.","Ликонцев А.Н., Шахобиддинов А.Ш.",,https://www.elibrary.ru/item.asp?id=30367911
217,8718,"ИССЛЕДОВАНИЕ ОСОБЕННОСТЕЙ РАБОТЫ СХЕМ СМЕСИТЕЛЕЙ (ПЕРЕМНОЖИТЕЛЕЙ) ЧАСТОТЫСазоненко Н.Ю., Сединин А.Д., Никитин Ю.А., Юрова В.А.



 В сборнике: Неделя науки СПбПУ. материалы научной конференции с международным участием. Институт физики, нанотехнологий и телекоммуникаций. 2017.  С. 48-50.","Сазоненко Н.Ю., Сединин А.Д., Никитин Ю.А., Юрова В.А.",,https://www.elibrary.ru/item.asp?id=31796922
