,number,title,authors,info,url
0,301,"БЕЗОПАСНОСТЬ ASTRA-LINUX: АНАЛИЗ И ПЕРСПЕКТИВЫШершнёв Д.Ю.

Научный аспект. 
2024. Т. 32. № 2.  С. 4084-4089.",Шершнёв Д.Ю.,,https://www.elibrary.ru/item.asp?id=65577402
1,302,"РАДИОПЕРЕХВАТ IOT ТРАФИКАМанжула К.А., Бударный Г.С.

Научный аспект. 
2024. Т. 33. № 2.  С. 4222-4226.","Манжула К.А., Бударный Г.С.",,https://www.elibrary.ru/item.asp?id=65515883
2,303,"АНАЛИЗ СОВРЕМЕННОГО ЗАКОНОДАТЕЛЬСТВА И ЕГО ВЛИЯНИЕ НА ЗАЩИТУ ДАННЫХТокарев Е.В.

Научный аспект. 
2024. Т. 37. № 1.  С. 4757-4762.",Токарев Е.В.,,https://www.elibrary.ru/item.asp?id=63361726
3,304,"СТАТИСТИКА КИБЕРПРЕСТУПНОСТИ И КИБЕРБЕЗОПАСНОСТИТокарев Е.В.

Научный аспект. 
2024. Т. 37. № 1.  С. 4762-4766.",Токарев Е.В.,,https://www.elibrary.ru/item.asp?id=63361728
4,305,"ТЕНДЕНЦИИ И УГРОЗЫ КИБЕРБЕЗОПАСНОСТИТокарев Е.В.

Научный аспект. 
2024. Т. 37. № 1.  С. 4767-4771.",Токарев Е.В.,,https://www.elibrary.ru/item.asp?id=63361729
5,306,"АНАЛИЗ УЯЗВИМОСТЕЙ И УГРОЗ БЕЗОПАСНОСТИ В ОПЕРАЦИОННОЙ СИСТЕМЕ LINUXПепп М.А.

Научный аспект. 
2024. Т. 39. № 1.  С. 5105-5110.",Пепп М.А.,,https://www.elibrary.ru/item.asp?id=63434739
6,307,"ИСПОЛЬЗОВАНИЕ DLP СИСТЕМ ДЛЯ ОБНАРУЖЕНИЯ СТЕГОКОНТЕЙНЕРОВШашин М.А.

Научный аспект. 
2024. Т. 39. № 1.  С. 5111-5118.",Шашин М.А.,,https://www.elibrary.ru/item.asp?id=63434740
7,308,"ВИДЫ УТЕЧКИ ИНФОРМАЦИИ ПРИ ПОМОЩИ РАДИОВОЛН И СПОСОБЫ ЗАЩИТЫБударный Г.С., Ахметов Р.Р., Камалова А.О., Соколов И.В.

Научный аспект. 
2024. Т. 41. № 1.  С. 5377-5390.","Бударный Г.С., Ахметов Р.Р., Камалова А.О., Соколов И.В.",,https://www.elibrary.ru/item.asp?id=63433326
8,309,"ИССЛЕДОВАНИЕ СОВРЕМЕННЫХ ТЕХНОЛОГИЙ ШИФРОВАНИЯ В КОНТЕКСТЕ РАДИОПЕРЕХВАТАБударный Г.С., Ахметов Р.Р., Камалова А.О., Манжула К.А.

Научный аспект. 
2024. Т. 41. № 1.  С. 5391-5401.","Бударный Г.С., Ахметов Р.Р., Камалова А.О., Манжула К.А.",,https://www.elibrary.ru/item.asp?id=63433327
9,310,"АТАКИ НА МАШИННОЕ ОБУЧЕНИЕХорошенко В.С.

Вопросы науки. 
2024. № 1.  С. 28-34.",Хорошенко В.С.,,https://www.elibrary.ru/item.asp?id=64568116
10,311,"МЕТОДЫ РАСПРЕДЕЛЕНИЯ РЕСУРСОВ КОНЦЕПЦИИ МОБИЛЬНЫХ ГРАНИЧНЫХ ВЫЧИСЛЕНИЙЧипсанова Е.В., Елагин В.С.

Наукоемкие технологии в космических исследованиях Земли. 
2024. Т. 16. № 1.  С. 4-13.","Чипсанова Е.В., Елагин В.С.",,https://www.elibrary.ru/item.asp?id=62998344
11,312,"ФОРМИРОВАНИЕ «ВИТРИН ДАННЫХ» НА ОСНОВЕ ТЕХНОЛОГИИ HADOOP ДЛЯ ПОДСИСТЕМЫ ИНТЕЛЛЕКТУАЛЬНОГО МОНИТОРИНГА РАСПРЕДЕЛЕННЫХ ИНФОРМАЦИОННО-ТЕЛЕКОММУНИКАЦИОННЫХ СЕТЕЙБудко П.А., Груздев А.А.

Электронный журнал: наука, техника и образование. 
2024. № S1 (45).  С. 163-171.","Будко П.А., Груздев А.А.",,https://www.elibrary.ru/item.asp?id=65634723
12,313,"ОЧЕРК О «КОРЕННЫХ ПРЕОБРАЗОВАНИЯХ» В ФИНАНСОВОЙ ПОЛИТИКЕ ЦАРСКОГО ПРАВИТЕЛЬСТВА И ПОПЫТКЕ СОЗДАНИЯ В РОССИИ ЦЕНТРОБАНКА В ГОДЫ ПЕРВОЙ МИРОВОЙ ВОЙНЫВоронов И.И., Пантелеев В.И.

Социально-экономический и гуманитарный журнал. 
2024. № 1 (31).  С. 214-228.","Воронов И.И., Пантелеев В.И.",,https://www.elibrary.ru/item.asp?id=65678036
13,314,"ИЗ ИСТОРИИ «СЕВЕРНОГО СОТРУДНИЧЕСТВА»: ИНТЕГРАЦИОННЫЕ ПРОЦЕССЫ В СТРАНАХ СЕВЕРНОЙ ЕВРОПЫ В ПОСЛЕВОЕННЫЙ ПЕРИОДМитасов В.А.

Санкт-Петербург и страны Северной Европы. 
2024. № 25 (1-2).  С. 108-120.",Митасов В.А.,,https://www.elibrary.ru/item.asp?id=64322806
14,315,"ШВЕДСКИЙ ФАКТОР В ПРОЦЕССЕ ОБРЕТЕНИЯ НЕЗАВИСИМОСТИ СТРАНАМИ БАЛТИИ (1918-1920 ГГ.)Гехт А.Б., Черкасов Д.Г.

Санкт-Петербург и страны Северной Европы. 
2024. № 25 (1-2).  С. 45-53.","Гехт А.Б., Черкасов Д.Г.",,https://www.elibrary.ru/item.asp?id=64322800
15,316,"ОСНОВНЫЕ ТРЕНДЫ ОБРАЗОВАТЕЛЬНОЙ ЦИФРОВОЙ ЭКОСИСТЕМЫКатасонова Г.Р.

Конструктивные педагогические заметки. 
2024. № 12-1 (21).  С. 13-19.",Катасонова Г.Р.,,https://www.elibrary.ru/item.asp?id=59552854
16,317,"ЗИМНЯЯ ВОЙНА В ОСВЕЩЕНИИ ФРАНЦУЗСКОЙ ПРЕССЫТерентьева Е.А.

Ученые записки Петрозаводского государственного университета. 
2024. Т. 46. № 2.  С. 96-104.",Терентьева Е.А.,,https://www.elibrary.ru/item.asp?id=61886142
17,318,"LIPID AND VOLATILE PROFILES OF VARIOUS GOAT PRIMAL CUTS: ASPECTS OF NUTRITIONAL VALUE AND FLAVOR/TASTE ATTRIBUTESSaengsuk N., Sangsawad P., Paengkoum P., Pongsetkul Ja.

Foods. 
2024. Т. 13. № 3.  С. 492.","Saengsuk N., Sangsawad P., Paengkoum P., Pongsetkul Ja.",,https://www.elibrary.ru/item.asp?id=65945685
18,319,"ПЕРСПЕКТИВЫ РАЗВИТИЯ НЕЙРОСЕТЕВЫХ ТЕХНОЛОГИЙ В УСЛОВИЯХ ЦИФРОВИЗАЦИИ ЭКОНОМИКИПавлова Е.В., Кулакова Ю.В.

Экономика и качество систем связи. 
2024. № 1 (31).  С. 10-17.","Павлова Е.В., Кулакова Ю.В.",,https://www.elibrary.ru/item.asp?id=65310941
19,320,"ОСОБЕННОСТИ ЦИФРОВОЙ ТРАНСФОРМАЦИИ МЕНЕДЖМЕНТА БИЗНЕС-ПРОЦЕССОВ ПРЕДПРИЯТИЯ НА ОСНОВЕ ЦИКЛА ДЕМИНГАМакаров В.В., Волчик О.В.

Экономика и качество систем связи. 
2024. № 1 (31).  С. 4-10.","Макаров В.В., Волчик О.В.",,https://www.elibrary.ru/item.asp?id=65310940
20,321,"ИЗУЧЕНИЕ РАБОТЫ АЛГОРИТМА НАИМЕНЬШИХ ЗНАЧИМЫХ БИТОВ И ЕГО РЕАЛИЗАЦИЯ НА ЯЗЫКЕ PYTHONВистунов С.С., Жиляков Г.В.

Международный журнал информационных технологий и энергоэффективности. 
2024. Т. 9. № 1 (39).  С. 31-38.","Вистунов С.С., Жиляков Г.В.",,https://www.elibrary.ru/item.asp?id=59512962
21,322,"СОВРЕМЕННЫЕ МЕТОДЫ БИОМЕТРИЧЕСКОЙ ИДЕНТИФИКАЦИИСтаранцова Е.В.

Международный журнал информационных технологий и энергоэффективности. 
2024. Т. 9. № 1 (39).  С. 44-48.",Старанцова Е.В.,,https://www.elibrary.ru/item.asp?id=59512965
22,323,"ЭВОЛЮЦИЯ ТЕХНОЛОГИЙ ЗАЩИТЫ ОТ ПИРАТСТВА В ИГРАХ: ОТ КЛАССИЧЕСКИХ МЕТОДОВ ДО НОВЕЙШИХ РЕШЕНИЙМикулин Ю.С.

Международный журнал информационных технологий и энергоэффективности. 
2024. Т. 9. № 2 (40).  С. 11-20.",Микулин Ю.С.,,https://www.elibrary.ru/item.asp?id=60774610
23,324,"БЕЗОПАСНОСТЬ ПРОГРАММНОГО ОБЕСПЕЧЕНИЯ: КАК ЗАЩИТИТЬ СВОЕ ПРИЛОЖЕНИЕ ОТ ХАКЕРСКИХ АТАКБарышников П.В.

Международный журнал информационных технологий и энергоэффективности. 
2024. Т. 9. № 3 (41).  С. 49-52.",Барышников П.В.,,https://www.elibrary.ru/item.asp?id=63698460
24,325,"ИНТЕГРАЦИЯ С API: КАК ВЗАИМОДЕЙСТВОВАТЬ С ВНЕШНИМИ СЕРВИСАМИ В СВОЕМ ПРИЛОЖЕНИИБарышников П.В.

Международный журнал информационных технологий и энергоэффективности. 
2024. Т. 9. № 3 (41).  С. 60-63.",Барышников П.В.,,https://www.elibrary.ru/item.asp?id=63698465
25,326,"АЛГОРИТМЫ И СТРУКТУРЫ ДАННЫХ: ОСНОВЫ ДЛЯ НАЧИНАЮЩИХ ПРОГРАММИСТОВУдальцов К.Р.

Международный журнал информационных технологий и энергоэффективности. 
2024. Т. 9. № 4 (42).  С. 152-155.",Удальцов К.Р.,,https://www.elibrary.ru/item.asp?id=65580160
26,327,"АССЕМБЛЕР: ИСКУССТВО ПРОГРАММИРОВАНИЯ У САМЫХ ОСНОВПеревертун Д.Р.

Международный журнал информационных технологий и энергоэффективности. 
2024. Т. 9. № 4 (42).  С. 73-78.",Перевертун Д.Р.,,https://www.elibrary.ru/item.asp?id=65580148
27,328,"ВИРУСЫ ПРОГРАММНОГО ОБЕСПЕЧЕНИЯ И МЕРЫ ОБЕСПЕЧЕНИЯ БЕЗОПАСНОСТИПеревертун Д.Р.

Международный журнал информационных технологий и энергоэффективности. 
2024. Т. 9. № 4 (42).  С. 84-88.",Перевертун Д.Р.,,https://www.elibrary.ru/item.asp?id=65580150
28,329,"СОВЕРШЕНСТВОВАНИЕ ЗАЩИТЫ ОТ СОЦИАЛЬНЫХ АТАК В ОБЛАСТИ ИНФОРМАЦИОННОЙ БЕЗОПАСНОСТИГельфанд А.М., Кузнецов С.А., Анучин К.Н.

Международный журнал информационных технологий и энергоэффективности. 
2024. Т. 9. № 4 (42).  С. 89-94.","Гельфанд А.М., Кузнецов С.А., Анучин К.Н.",,https://www.elibrary.ru/item.asp?id=65580151
29,330,"ПСИХОЛОГИЧЕСКИЕ АСПЕКТЫ КИБЕРБЕЗОПАСНОСТИПеревертун Д.Р.

Международный журнал информационных технологий и энергоэффективности. 
2024. Т. 9. № 4 (42).  С. 95-99.",Перевертун Д.Р.,,https://www.elibrary.ru/item.asp?id=65580152
30,331,"К ВОПРОСУ УСТОЙЧИВОГО МАШИННОГО ОБУЧЕНИЯХорошенко В.С.

Наукосфера. 
2024. № 1-1.  С. 204-208.",Хорошенко В.С.,,https://www.elibrary.ru/item.asp?id=60774590
31,332,"DESIGNING THE ARCHITECTURE OF A MULTI-AGENT CITYMANAGEMENT SYSTEM USING ADVANCEDOBJECT-ORIENTED MODELINGBondarenko I.B., Litvinov V.L., Pelikh D.A., Rozhkova D.A., Filippov F.V.



 В сборнике: Digital and InformationTechnologies in Economics and Management (DITEM2023). Proceedings of the International Scienti c and Practical Conference. Lecture Notes in Networks and Systems. Cham, 2024.  С. 106-117.","Bondarenko I.B., Litvinov V.L., Pelikh D.A., Rozhkova D.A., Filippov F.V.",,https://www.elibrary.ru/item.asp?id=64904311
32,333,"ИССЛЕДОВАНИЕ ЭФФЕКТИВНОСТИ БУРЕНИЯ ГОРНЫХ ПОРОД ПРИ ИСПОЛЬЗОВАНИИ ПОРШНЯ-УДАРНИКА С БОЙКОМ И РЕГУЛИРУЕМОЙ ЗАДВИЖКИ В ПОГРУЖНОМ ПНЕВМОУДАРНИКЕЮнгмейстер Д.А., Гасымов Э.Э., Борисов С.В., Тимофеев М.И.

Транспортное, горное и строительное машиностроение: наука и производство. 
2024. № 24.  С. 96-105.","Юнгмейстер Д.А., Гасымов Э.Э., Борисов С.В., Тимофеев М.И.",,https://www.elibrary.ru/item.asp?id=64381800
33,334,"СИСТЕМАТИЧЕСКИЙ ОБЗОР: АНАЛИЗ УЯЗВИМОСТЕЙ КОДИРОВАНИЯ НА РАЗНЫХ ЯЗЫКАХГолубятников А.О.

Столыпинский вестник. 
2024. Т. 6. № 1.",Голубятников А.О.,,https://www.elibrary.ru/item.asp?id=60005249
34,335,"ТРЕБОВАНИЯ КИБЕРБЕЗОПАСНОСТИ ДЛЯ ИНФОРМАЦИОННЫХ СИСТЕМ УПРАВЛЕНИЯГолубятников А.О.

Столыпинский вестник. 
2024. Т. 6. № 2.",Голубятников А.О.,,https://www.elibrary.ru/item.asp?id=62099871
35,336,"SPATIAL DATA OF SMART CITIES: TRUSTShestakov A.V., Nesterov A.A.



 В сборнике: Secure Edge and Fog Computing Enabled AI for IoT and Smart Cities. Includes selected Papers from International Conference on Advanced Computing & Next-Generation Communication (ICACNGC 2022). Ghent, Belgium, 2024.  С. 209-217.","Shestakov A.V., Nesterov A.A.",,https://www.elibrary.ru/item.asp?id=66089973
36,337,"ПОЛОЖЕНИЕ МУСУЛЬМАНСКИХ ОБЩИН В СТРАНАХ СЕВЕРНОЙ ЕВРОПЫРоманенко В.Е.

Социогуманитарные коммуникации. 
2024. № 1 (7).  С. 134-139.",Романенко В.Е.,,https://www.elibrary.ru/item.asp?id=63990725
37,338,"ФОРМИРОВАНИЕ ЯВЛЕНИЯ ОХРАНЫ ПРИРОДЫ В ШВЕЦИИ В КОНЦЕ XIX - ПЕРВОЙ ПОЛОВИНЕ ХХ ВЦверианашвили И.А.

Социогуманитарные коммуникации. 
2024. № 1 (7).  С. 31-35.",Цверианашвили И.А.,,https://www.elibrary.ru/item.asp?id=63990706
38,339,"ПРЕБЫВАНИЕ ЦЕСАРЕВИЧА АЛЕКСАНДРА НИКОЛАЕВИЧА В ШВЕЦИИ И ДАНИИ В 1838 ГЯковлев О.А.

Социогуманитарные коммуникации. 
2024. № 1 (7).  С. 56-62.",Яковлев О.А.,,https://www.elibrary.ru/item.asp?id=63990713
39,340,"СЕВЕРНОЕ ДВИЖЕНИЕ СОПРОТИВЛЕНИЯ: ИСТОРИЯ ФОРМИРОВАНИЯ И СОВРЕМЕННАЯ СПЕЦИФИКА ДВИЖЕНИЯЧеркасов Д.Г.

Социогуманитарные коммуникации. 
2024. № 1 (7).  С. 63-68.",Черкасов Д.Г.,,https://www.elibrary.ru/item.asp?id=63990714
40,341,"ОБРАЗНО-СИМВОЛИЧЕСКАЯ СИСТЕМА СТИХОТВОРНОГО СБОРНИКА М. МЁРТЛУНД «Я ЕДУ ЧЕРЕЗ ЮХОНПИЕТИ, КОГДА ЦВЕТЁТ ИВАН-ЧАЙ»Алёшин А.С.

Социогуманитарные коммуникации. 
2024. № 1 (7).  С. 97-103.",Алёшин А.С.,,https://www.elibrary.ru/item.asp?id=63990718
41,342,"ОСНОВНЫЕ ТЕЧЕНИЯ ФЕМИНИЗМА В СОВРЕМЕННОЙ ТУРЦИИЖадан Р.А.

Социогуманитарные коммуникации. 
2024. № 2 (8).  С. 100-108.",Жадан Р.А.,,https://www.elibrary.ru/item.asp?id=65618370
42,343,"ЭМОЦИОНАЛЬНЫЙ ИНТЕЛЛЕКТ В МЕЖЛИЧНОСТНЫХ КОММУНИКАЦИЯХСтецко А.А., Шутман Д.В.

Социогуманитарные коммуникации. 
2024. № 2 (8).  С. 109-117.","Стецко А.А., Шутман Д.В.",,https://www.elibrary.ru/item.asp?id=65618371
43,344,"PROCESS MINING AS THE LATEST TOOL OF PROCESS MANAGEMENTAntonov K.M., Ivanova V.A.

Sociohumanitarnye Kommunikacii. 
2024. № 2 (8).  С. 118-123.","Antonov K.M., Ivanova V.A.",,https://www.elibrary.ru/item.asp?id=65618372
44,345,"ИНТЕРЕСНОЕ ИССЛЕДОВАНИЕ РЕГИОНАЛЬНОГО АСПЕКТА ИСТОРИИ ГРАЖДАНСКОЙ ВОЙНЫ. РЕЦ. НА КН.: ПОЗДНЯКОВА А. С. «ВЯТСКАЯ ГУБЕРНИЯ В ГОДЫ ГРАЖДАНСКОЙ ВОЙНЫ: ЧРЕЗВЫЧАЙНЫЕ ОРГАНЫ ВЛАСТИ»Измозик В.С.

Социогуманитарные коммуникации. 
2024. № 2 (8).  С. 136-141.",Измозик В.С.,,https://www.elibrary.ru/item.asp?id=65618374
45,346,"МОЯ РОДОСЛОВНАЯКомарова А.А.

Социогуманитарные коммуникации. 
2024. № 2 (8).  С. 17-34.",Комарова А.А.,,https://www.elibrary.ru/item.asp?id=65618361
46,347,"ОЧЕРК ВОСТОЧНОЙ ПОЛИТИКИ ПОЛЬШИ 1918 - 1939 ГГВоронов И.И., Тихоньких В.П.

Социогуманитарные коммуникации. 
2024. № 2 (8).  С. 35-46.","Воронов И.И., Тихоньких В.П.",,https://www.elibrary.ru/item.asp?id=65618362
47,348,"«СВЯТОЙ ДОЛГ СЛУЖБЫ ДОРОЖЕ ДЛЯ МЕНЯ ЖИЗНИ» РОЛЬ ПОЛЕВОЙ ПОЧТЫ В РУССКОЙ АРМИИ И ДЕЯТЕЛЬНОСТЬ ЧИНОВ ПОЧТОВОГО ВЕДОМСТВА В ОТЕЧЕСТВЕННОЙ ВОЙНЕ 1812 ГОДАМальцева О.Л., Фортунова У.В.

Социогуманитарные коммуникации. 
2024. № 2 (8).  С. 63-73.","Мальцева О.Л., Фортунова У.В.",,https://www.elibrary.ru/item.asp?id=65618365
48,349,"ИЗ ИСТОРИИ РОССИЙСКО-КИТАЙСКИХ ОТНОШЕНИЙ: ЭКСПЕДИЦИИ И. ПЕТЛИНА И Ф. И. БАЙКОВААверьянов М.А.

Социогуманитарные коммуникации. 
2024. № 2 (8).  С. 7-12.",Аверьянов М.А.,,https://www.elibrary.ru/item.asp?id=65618359
49,350,"СОТРУДНИЧЕСТВО ТУРКМЕНИСТАНА И ВЕЛИКОБРИТАНИИ НА СОВРЕМЕННОМ ЭТАПЕМиронова У.В.

Социогуманитарные коммуникации. 
2024. № 2 (8).  С. 92-99.",Миронова У.В.,,https://www.elibrary.ru/item.asp?id=65618368
50,351,"ПРОГРАММА ДЛЯ ПОВЫШЕНИЯ ЭФФЕКТИВНОСТИ АЛГОРИТМОВ ИДЕНТИФИКАЦИИ ЛИЦТитаренко И.О., Вивчарь Р.М., Пачин А.В., Баряев А.А., Киричек Р.В., Степаненков Г.В.



Свидетельство о регистрации программы для ЭВМ RU 2023664123, 30.06.2023.
 Заявка № 2023662371 от 14.06.2023.","Титаренко И.О., Вивчарь Р.М., Пачин А.В., Баряев А.А., Киричек Р.В., Степаненков Г.В.",,https://www.elibrary.ru/item.asp?id=54199033
51,352,"ГЕНЕРАТОР ЭКЗАМЕНАЦИОННЫХ БИЛЕТОВБелоус К.В., Верхова Г.В.



Свидетельство о регистрации программы для ЭВМ RU 2023615723, 17.03.2023.
 Заявка № 2023614054 от 03.03.2023.","Белоус К.В., Верхова Г.В.",,https://www.elibrary.ru/item.asp?id=50428601
52,353,"МЕХАНИЗМ РАСПРЕДЕЛЕНИЯ МОЩНОСТИ В ТРАНСМИССИИ ТРАНСПОРТНОГО СРЕДСТВАДобрецов Р.Ю., Семенов А.Г.



Патент на изобретение RU 2789152 C1, 30.01.2023.
 Заявка № 2022118368 от 05.07.2022.","Добрецов Р.Ю., Семенов А.Г.",,https://www.elibrary.ru/item.asp?id=50267000
53,354,"ПРОГРАММА ИМИТАЦИОННОГО МОДЕЛИРОВАНИЯ АЛГОРИТМОВ ПРОСТРАНСТВЕННОЙ ОБРАБОТКИ СИГНАЛОВ В МНОГОАНТЕННЫХ СИСТЕМАХ ПО ДИСЦИПЛИНЕ ""ОСНОВЫ ТЕХНОЛОГИИ MIMO""Фокин Г.А.



Свидетельство о регистрации программы для ЭВМ RU 2023617756, 13.04.2023.
 Заявка № 2023616782 от 07.04.2023.",Фокин Г.А.,,https://www.elibrary.ru/item.asp?id=52298902
54,355,"SKILLCHECKЛикарь А.И., Рассказчиков И.Т.



Свидетельство о регистрации программы для ЭВМ RU 2023666024, 25.07.2023.
 Заявка № 2023664652 от 11.07.2023.","Ликарь А.И., Рассказчиков И.Т.",,https://www.elibrary.ru/item.asp?id=54337654
55,356,"ПРОГРАММНЫЙ МОДУЛЬ ИССЛЕДОВАНИЯ ЗАВИСИМОСТИ ТОЧНОСТИ ПОЗИЦИОНИРОВАНИЯ И ОРИЕНТАЦИИ УСТРОЙСТВ В ПРОСТРАНСТВЕ ОТ ТЕРРИТОРИАЛЬНОГО РАЗНОСА В МОДЕЛИ БЛИЖНЕЙ И ДАЛЬНЕЙ ЗОН В СВЕРХПЛОТНЫХ СЕТЯХ МИЛЛИМЕТРОВОГО И ТЕРАГЕРЦОВОГО ДИАПАЗОНАФокин Г.А., Кучерявый А.Е., Нестерова Я.О.



Свидетельство о регистрации программы для ЭВМ RU 2023682184, 23.10.2023.
 Заявка от 12.10.2023.","Фокин Г.А., Кучерявый А.Е., Нестерова Я.О.",,https://www.elibrary.ru/item.asp?id=56001314
56,357,"ПРОГРАММНЫЙ МОДУЛЬ ИССЛЕДОВАНИЯ ЗАВИСИМОСТИ ТОЧНОСТИ ПОЗИЦИОНИРОВАНИЯ И ОРИЕНТАЦИИ УСТРОЙСТВ В ПРОСТРАНСТВЕ ОТ ШИРИНЫ ПОЛОСЫ ЧАСТОТ И ВЛИЯНИЯ ЭФФЕКТА РАСЩЕПЛЕНИЯ ЛУЧА В СВЕРХПЛОТНЫХ СЕТЯХ МИЛЛИМЕТРОВОГО И ТЕРАГЕРЦОВОГО ДИАПАЗОНАФокин Г.А., Кучерявый А.Е., Свечников Д.С.



Свидетельство о регистрации программы для ЭВМ RU 2023682237, 24.10.2023.
 Заявка от 19.10.2023.","Фокин Г.А., Кучерявый А.Е., Свечников Д.С.",,https://www.elibrary.ru/item.asp?id=56001371
57,358,"ПРОГРАММА ДЛЯ КОНТРОЛЯ И УПРАВЛЕНИЯ РОБОТИЗИРОВАННОЙ ПЛАТФОРМОЙВиноградов С.В., Передистов Е.Ю.



Свидетельство о регистрации программы для ЭВМ RU 2023682414, 25.10.2023.
 Заявка от 19.10.2023.","Виноградов С.В., Передистов Е.Ю.",,https://www.elibrary.ru/item.asp?id=56001550
58,359,"ПРОГРАММА ДЛЯ ОБРАБОТКИ ЗВУКОВЫХ СИГНАЛОВ С ПОМОЩЬЮ АЛГОРИТМА РЕВЕРБЕРАЦИИ НА ОСНОВЕ СЕТЕЙ ЗАДЕРЖЕКПетрова Н.А., Свиньина О.А.



Свидетельство о регистрации программы для ЭВМ RU 2023683403, 07.11.2023.
 Заявка от 27.10.2023.","Петрова Н.А., Свиньина О.А.",,https://www.elibrary.ru/item.asp?id=56002709
59,360,"ОЦЕНКА СТАТИСТИЧЕСКИХ ДАННЫХ ИНФОКОММУНИКАЦИОННЫХ СИСТЕМШерстнева А.А.



Свидетельство о регистрации программы для ЭВМ RU 2023688803, 25.12.2023.
 Заявка от 05.12.2023.",Шерстнева А.А.,,https://www.elibrary.ru/item.asp?id=59915065
60,361,"РАСЧЕТ ВЛИЯНИЯ ПОМЕХ РАДИОПРИЕМНОМУ УСТРОЙСТВУ БЕСПИЛОТНОГО ЛЕТАТЕЛЬНОГО АППАРАТА ОТ СТАЦИОНАРНЫХ ПЕРЕДАТЧИКОВАнтипин Б.М., Виноградов Е.М., Пономарев Д.С.



Свидетельство о регистрации программы для ЭВМ RU 2023688905, 25.12.2023.
 Заявка от 05.12.2023.","Антипин Б.М., Виноградов Е.М., Пономарев Д.С.",,https://www.elibrary.ru/item.asp?id=59915167
61,362,"МЕТОДИКА И МЕТОДЫ ОБЕСПЕЧЕНИЯ АУДИТА СРЕДСТВ ВЫЧИСЛИТЕЛЬНОЙ ТЕХНИКИ ДЛЯ РАССЛЕДОВАНИЯ КОМПЬЮТЕРНЫХ ИНЦИДЕНТОВПантюхин И.С.



диссертация на соискание ученой степени кандидата технических наук / ФЕДЕРАЛЬНОЕ ГОСУДАРСТВЕННОЕ БЮДЖЕТНОЕ ОБРАЗОВАТЕЛЬНОЕ УЧРЕЖДЕНИЕ ВЫСШЕГО ОБРАЗОВАНИЯ ""САНКТ-ПЕТЕРБУРГСКИЙ ГОСУДАРСТВЕННЫЙ УНИВЕРСИТЕТ ТЕЛЕКОММУНИКАЦИЙ ИМ. ПРОФ. М.А. БОНЧ-БРУЕВИЧА"". 
2023",Пантюхин И.С.,,https://www.elibrary.ru/item.asp?id=59954614
